{
  "$schema": "https://json-schema.org/draft/2020-12/schema",
  "$id": "https://cancerdao.org/schemas/cancer-buddy/treatment_lines.schema.json",
  "title": "TreatmentEpisodes",
  "description": "Source-reported treatment episodes. Line numbers are copied only when explicitly documented. v2.1 adds status + status_basis (required; registered from source wording only — organize never infers a line or whether therapy continues beyond what a source says), status_basis_text, status_as_of, line_number and medication_refs; the optional cycle_label_verbatim and status_as_of_precision came later without a version bump (optional fields). A cycle is not a line: every cycle of one regimen is ONE episode. Legacy schema_version \"2\" archives are read leniently (WARN, not FAIL).",
  "type": "object",
  "required": ["patient_code", "schema_version", "episodes"],
  "additionalProperties": false,
  "properties": {
    "patient_code": { "type": "string", "pattern": "^PT-[A-F0-9]+(_\\d+)?$" },
    "schema_version": { "const": "2.1" },
    "generated_at": { "type": "string", "format": "date-time" },
    "episodes": {
      "type": "array",
      "items": {
        "type": "object",
        "required": ["episode_id", "sequence_index", "regimen", "source_refs", "provenance_layer", "verification_status", "status", "status_basis"],
        "additionalProperties": false,
        "properties": {
          "episode_id": { "type": "string" },
          "sequence_index": { "type": "integer", "minimum": 0, "description": "Chronological ordering only; not a clinical line number." },
          "documented_line_label": { "type": ["string", "null"], "description": "Verbatim LINE wording only (二线 / second-line …) when a clinician source states it. Cycle wording (第4程, C2D1 …) is not a line and goes to cycle_label_verbatim." },
          "cycle_label_verbatim": { "type": ["string", "null"], "minLength": 1, "description": "Optional verbatim cycle wording of the source the status rests on (第4程, 第二周期, C2D1 …). All cycles of one regimen are ONE episode (started_at = the first cycle's date); the cycle label is recorded here, never as documented_line_label or line_number." },
          "phase_or_intent_source": { "type": ["string", "null"], "description": "Verbatim adjuvant/neoadjuvant/maintenance/consolidation/etc. wording; no inference." },
          "regimen": { "type": "string" },
          "started_at": { "type": ["string", "null"], "format": "date" },
          "ended_at": { "type": ["string", "null"], "format": "date" },
          "clinician_reported_response": { "type": ["string", "null"], "description": "Copied from clinician source; never calculated." },
          "reason_for_change_source": { "type": ["string", "null"] },
          "provenance_layer": { "enum": ["source_reported", "patient_reported", "caregiver_reported", "system_normalized", "prior_archive"] },
          "verification_status": { "enum": ["unverified", "clinician_verified", "disputed"] },
          "source_refs": { "$ref": "#/$defs/source_refs" },
          "status": { "enum": ["ongoing", "stopped", "unknown"], "description": "Registered from source wording only (正在/继续/第N程, an imaging request stating the patient is on X, a family statement …)." },
          "status_basis": { "enum": ["administration_record", "clinician_note_current", "order_or_indication_only", "patient_reported", "dates_only", "none"], "description": "Which kind of source the status rests on; reliability is graded downstream." },
          "status_basis_text": { "type": ["string", "null"], "description": "Verbatim source wording the status rests on." },
          "status_as_of": { "type": ["string", "null"], "pattern": "^[0-9]{4}-[0-9]{2}-[0-9]{2}$", "description": "Date (YYYY-MM-DD) of the source the status rests on. For status ongoing it is null ONLY in the undated self-report form (status_basis patient_reported + status_as_of_precision undated_self_report)." },
          "status_as_of_precision": { "enum": ["day", "undated_self_report"], "description": "Optional. day (the meaning when absent) = status_as_of is the source's own date. undated_self_report = a patient/family statement that carries no date of its own (\"这个方案现在还在用\"): status_as_of is null, status_basis is patient_reported and provenance_layer is patient_reported / caregiver_reported (by who said it); downstream words it as an undated family statement to be confirmed with the treating team." },
          "line_number": { "type": ["integer", "null"], "minimum": 1, "description": "Only when a source literally states the line number; never counted from the episode list." },
          "alt_readings": {
            "type": "array",
            "description": "Other readings of regimen when it carries an [OCR_UNCERTAIN:U-nnn] token (the field keeps its literal + token). Optional; never promoted.",
            "items": {
            "type": "object",
            "required": ["field", "uncertain_id", "source_ref", "channel", "text"],
            "additionalProperties": false,
            "description": "Another reading of a token-bearing text field: the other channel's reading of the same span, or a high-confidence lexicon candidate (channel lexicon:<name>). A reading, never a value: it is never promoted into the field.",
            "properties": {
              "field": { "type": "string", "minLength": 1 },
              "uncertain_id": { "type": "string", "pattern": "^U-\\d{3,}$" },
              "source_ref": { "type": "string", "minLength": 1 },
              "channel": { "type": "string", "minLength": 1 },
              "text": { "type": ["string", "null"] }
            }
            }
          },
          "medication_refs": { "type": "array", "items": { "type": "string", "minLength": 1 }, "description": "Optional comorbidities.json medications[].medication_id of the order rows this episode was given from." }
        },
        "allOf": [
          {
            "if": { "properties": { "status": { "const": "ongoing" } }, "required": ["status"] },
            "then": {
              "required": ["status_as_of"],
              "properties": { "status_basis": { "not": { "const": "none" } } },
              "anyOf": [
                { "properties": { "status_as_of": { "type": "string" } } },
                { "required": ["status_as_of_precision"], "properties": { "status_as_of": { "type": "null" }, "status_basis": { "const": "patient_reported" }, "status_as_of_precision": { "const": "undated_self_report" } } }
              ]
            }
          },
          {
            "if": { "properties": { "status_as_of_precision": { "const": "undated_self_report" } }, "required": ["status_as_of_precision"] },
            "then": { "required": ["provenance_layer"], "properties": { "status_as_of": { "type": "null" }, "status_basis": { "const": "patient_reported" }, "provenance_layer": { "enum": ["patient_reported", "caregiver_reported"] } } }
          },
          {
            "if": { "properties": { "status_as_of_precision": { "const": "day" } }, "required": ["status_as_of_precision"] },
            "then": { "required": ["status_as_of"], "properties": { "status_as_of": { "type": "string" } } }
          },
          {
            "if": { "properties": { "status_basis": { "enum": ["administration_record", "clinician_note_current", "order_or_indication_only", "patient_reported"] } }, "required": ["status_basis"] },
            "then": { "required": ["status_basis_text"], "properties": { "status_basis_text": { "type": "string", "minLength": 1 } } }
          },
          {
            "if": { "properties": { "status_basis": { "const": "none" } }, "required": ["status_basis"] },
            "then": { "properties": { "status": { "const": "unknown" } } }
          }
        ]
      }
    }
  },
  "$defs": { "source_refs": { "type": "array", "minItems": 1, "items": { "type": "string" } } }
}
